{
  "$schema": "../../schemas/route.schema.json",
  "name": "training",
  "description": "Training route - IFSC + U15 combined (deduplicated by position)",
  "columns": "ABCDEFGHILM",
  "color": {
    "RED": "#FF0000",
    "DARKRED": "#B22222"
  },
  "holds": [
    "DX1 FOOT F4 G4 @P1",
    "DX1 FOOT A7 A8 @Q1 #DARKRED",
    "DX1 FOOT A10 B10 @P2",
    "DX1 BIG F10 DX2:C1 @N1 #DARKRED",
    "DX2 BIG F1 D3 @M1",
    "SN2 FOOT H1 I1 @Q2 #DARKRED",
    "DX2 BIG G3 E5 @M2",
    "SN2 FOOT G3 H3 @P3",
    "DX2 BIG A9 C10 @M3",
    "SN3 BIG F2 SN2:F10 @N2 #DARKRED",
    "SN3 BIG G4 G1 @M4",
    "DX3 FOOT C6 C5 @P4",
    "SN3 BIG M10 I8 @M5",
    "DX4 BIG B2 D3 @M6",
    "SN4 BIG M8 L10 @M7",
    "DX5 FOOT E1 E2 @P5",
    "SN5 FOOT H1 SN4:H10 @P6",
    "DX5 BIG C3 C6 @M8",
    "SN5 FOOT M6 M5 @P7",
    "SN5 FOOT E7 E6 @P8",
    "DX5 BIG E9 H9 @M9",
    "DX6 FOOT D1 D2 @Q3 #DARKRED",
    "SN6 BIG H2 E2 @M10",
    "SN6 BIG L7 M9 @M11",
    "SN6 BIG F9 F6 @M12",
    "SN7 BIG M4 DX7:A5 @M13",
    "SN7 BIG G9 E8 @M14",
    "DX7 FOOT B10 A10 @P9",
    "DX8 FOOT E1 F1 @P10",
    "SN8 BIG L1 SN7:H10 @M15",
    "SN8 BIG I3 L5 @M16",
    "DX8 FOOT A5 A6 @P11",
    "SN8 STOP D7 D7 @PAD-U15",
    "DX9 BIG A2 C4 @M18",
    "DX9 BIG E7 E9 @M19",
    "SN9 BIG M10 DX10:A1 @M20",
    "DX10 STOP A8 A8 @PAD"
  ],
  "smearingZones": [
    {
      "label": "A1",
      "panel": "SN2",
      "column": "M",
      "row": 4,
      "width": 4,
      "height": 3
    },
    {
      "label": "A2",
      "panel": "SN3",
      "column": "I",
      "columnOffset": 0,
      "row": 3,
      "width": 5,
      "height": 4
    },
    {
      "label": "A3",
      "panel": "DX5",
      "column": "F",
      "columnOffset": 0,
      "row": 1,
      "width": 4,
      "height": 3
    },
    {
      "label": "A4",
      "panel": "SN5",
      "column": "F",
      "columnOffset": 0,
      "row": 9,
      "width": 5,
      "height": 3
    },
    {
      "label": "A5",
      "panel": "SN8",
      "column": "H",
      "columnOffset": 0,
      "row": 7,
      "width": 8,
      "height": 4.5
    },
    {
      "label": "A6",
      "panel": "SN9",
      "column": "I",
      "columnOffset": 0,
      "row": 4,
      "width": 3,
      "height": 3
    }
  ]
}
