{
  "$schema": "../../schemas/route.schema.json",
  "name": "u11-u13-de-it",
  "description": "U11-U13 Speed Route (Germany/Italy) - 10m",
  "holdTypes": {
    "BIG": { "width": 460, "height": 350 },
    "FOOT": { "width": 70, "height": 78 },
    "BIG-DE15": { "width": 173, "height": 285 },
    "FOOT-DE15": { "width": 88, "height": 73 }
  },
  "columns": "ABCDEFGHILM",
  "color": "#008000",
  "holds": [
    "DX1 FOOT F4 G4 @F1",
    "DX1 FOOT A10 B10 @F2",
    "DX2 BIG F1 D3 @H1",
    "DX2 BIG G3 E5 @H2",
    "DX2 BIG A9 C10 @H3",
    "SN2 FOOT G3 H3 @F3",
    "DX3 FOOT C6 C5 @F4",
    "SN3 BIG G4 G1 @H4",
    "SN3 BIG M10 I8 @H5",
    "DX4 BIG B2 D3 @H6",
    "SN4 BIG M8 L10 @H7",
    "DX5 FOOT E1 E2 @F5",
    "DX5 BIG C3 C6 @H8",
    "DX5 BIG E9 H9 @H9",
    "SN5 FOOT H1 SN4:H10 @F6",
    "SN5 FOOT M6 M5 @F7",
    "SN5 FOOT E7 E6 @F8",
    "SN6 BIG H2 E2 @H10",
    "SN6 BIG L7 M9 @H11",
    "SN6 BIG F9 F6 @H12",
    "DX1 FOOT-DE15 F2 E2 @G1",
    "DX1 FOOT-DE15 B7 A7 @G2",
    "DX1 BIG-DE15 F9 H8 @I1",
    "DX1 BIG-DE15 G10 I9 @I2",
    "SN2 FOOT-DE15 M1 L1 @G3",
    "DX2 BIG-DE15 C4 A4 @I3",
    "SN2 FOOT-DE15 I5 H5 @G4",
    "SN3 BIG-DE15 I1 SN2:I10 @I4",
    "SN3 BIG-DE15 M6 L5 @I5",
    "SN4 FOOT-DE15 L4 I4 @G5",
    "DX4 FOOT-DE15 C10 B10 @G6",
    "SN5 FOOT-DE15 M10 L10 @G7",
    "SN7 STOP M3 M3 @PAD"
  ],
  "smearingZones": [
    {
      "label": "R4",
      "panel": "SN5",
      "column": "F",
      "columnOffset": 0,
      "row": 9,
      "width": 5,
      "height": 3
    }
  ]
}
